<?xml version="1.0" encoding="UTF-8"?>
<IrrGoBoard xmlns:xsi="http://www.w3.org/2001/XMLSchema-instance" xsi:noNamespaceSchemaLocation="irrgo.xsd">
    <rectangularP val="False"/>
    <coord_list>
        <coord>
            <node id="0000"/>
            <R val="0"/>
            <C val="0"/>
        </coord>
        <coord>
            <node id="0020"/>
            <R val="0"/>
            <C val="20"/>
        </coord>
        <coord>
            <node id="1500"/>
            <R val="15"/>
            <C val="0"/>
        </coord>
        <coord>
            <node id="1520"/>
            <R val="15"/>
            <C val="20"/>
        </coord>
        <coord>
            <node id="0903"/>
            <R val="9"/>
            <C val="3"/>
        </coord>
        <coord>
            <node id="1307"/>
            <R val="13"/>
            <C val="7"/>
        </coord>
        <coord>
            <node id="0404"/>
            <R val="4"/>
            <C val="4"/>
        </coord>
        <coord>
            <node id="0604"/>
            <R val="6"/>
            <C val="4"/>
        </coord>
        <coord>
            <node id="1503"/>
            <R val="15"/>
            <C val="3"/>
        </coord>
        <coord>
            <node id="0202"/>
            <R val="2"/>
            <C val="2"/>
        </coord>
        <coord>
            <node id="1408"/>
            <R val="14"/>
            <C val="8"/>
        </coord>
        <coord>
            <node id="0119"/>
            <R val="1"/>
            <C val="19"/>
        </coord>
        <coord>
            <node id="1207"/>
            <R val="12"/>
            <C val="7"/>
        </coord>
        <coord>
            <node id="0110"/>
            <R val="1"/>
            <C val="10"/>
        </coord>
        <coord>
            <node id="1315"/>
            <R val="13"/>
            <C val="15"/>
        </coord>
        <coord>
            <node id="1511"/>
            <R val="15"/>
            <C val="11"/>
        </coord>
        <coord>
            <node id="0510"/>
            <R val="5"/>
            <C val="10"/>
        </coord>
        <coord>
            <node id="0401"/>
            <R val="4"/>
            <C val="1"/>
        </coord>
        <coord>
            <node id="0812"/>
            <R val="8"/>
            <C val="12"/>
        </coord>
        <coord>
            <node id="0320"/>
            <R val="3"/>
            <C val="20"/>
        </coord>
        <coord>
            <node id="0118"/>
            <R val="1"/>
            <C val="18"/>
        </coord>
        <coord>
            <node id="1313"/>
            <R val="13"/>
            <C val="13"/>
        </coord>
        <coord>
            <node id="0920"/>
            <R val="9"/>
            <C val="20"/>
        </coord>
        <coord>
            <node id="1009"/>
            <R val="10"/>
            <C val="9"/>
        </coord>
        <coord>
            <node id="0307"/>
            <R val="3"/>
            <C val="7"/>
        </coord>
        <coord>
            <node id="1514"/>
            <R val="15"/>
            <C val="14"/>
        </coord>
        <coord>
            <node id="0810"/>
            <R val="8"/>
            <C val="10"/>
        </coord>
        <coord>
            <node id="1119"/>
            <R val="11"/>
            <C val="19"/>
        </coord>
        <coord>
            <node id="1502"/>
            <R val="15"/>
            <C val="2"/>
        </coord>
        <coord>
            <node id="1104"/>
            <R val="11"/>
            <C val="4"/>
        </coord>
        <coord>
            <node id="0116"/>
            <R val="1"/>
            <C val="16"/>
        </coord>
        <coord>
            <node id="1317"/>
            <R val="13"/>
            <C val="17"/>
        </coord>
        <coord>
            <node id="1105"/>
            <R val="11"/>
            <C val="5"/>
        </coord>
        <coord>
            <node id="0111"/>
            <R val="1"/>
            <C val="11"/>
        </coord>
        <coord>
            <node id="0104"/>
            <R val="1"/>
            <C val="4"/>
        </coord>
        <coord>
            <node id="0301"/>
            <R val="3"/>
            <C val="1"/>
        </coord>
        <coord>
            <node id="0103"/>
            <R val="1"/>
            <C val="3"/>
        </coord>
        <coord>
            <node id="1504"/>
            <R val="15"/>
            <C val="4"/>
        </coord>
        <coord>
            <node id="1208"/>
            <R val="12"/>
            <C val="8"/>
        </coord>
        <coord>
            <node id="0300"/>
            <R val="3"/>
            <C val="0"/>
        </coord>
        <coord>
            <node id="1218"/>
            <R val="12"/>
            <C val="18"/>
        </coord>
        <coord>
            <node id="0914"/>
            <R val="9"/>
            <C val="14"/>
        </coord>
        <coord>
            <node id="0508"/>
            <R val="5"/>
            <C val="8"/>
        </coord>
        <coord>
            <node id="0415"/>
            <R val="4"/>
            <C val="15"/>
        </coord>
        <coord>
            <node id="0820"/>
            <R val="8"/>
            <C val="20"/>
        </coord>
        <coord>
            <node id="0305"/>
            <R val="3"/>
            <C val="5"/>
        </coord>
        <coord>
            <node id="1316"/>
            <R val="13"/>
            <C val="16"/>
        </coord>
        <coord>
            <node id="0904"/>
            <R val="9"/>
            <C val="4"/>
        </coord>
        <coord>
            <node id="0817"/>
            <R val="8"/>
            <C val="17"/>
        </coord>
        <coord>
            <node id="0900"/>
            <R val="9"/>
            <C val="0"/>
        </coord>
        <coord>
            <node id="0214"/>
            <R val="2"/>
            <C val="14"/>
        </coord>
        <coord>
            <node id="1409"/>
            <R val="14"/>
            <C val="9"/>
        </coord>
        <coord>
            <node id="1501"/>
            <R val="15"/>
            <C val="1"/>
        </coord>
        <coord>
            <node id="0519"/>
            <R val="5"/>
            <C val="19"/>
        </coord>
        <coord>
            <node id="1310"/>
            <R val="13"/>
            <C val="10"/>
        </coord>
        <coord>
            <node id="0210"/>
            <R val="2"/>
            <C val="10"/>
        </coord>
        <coord>
            <node id="1414"/>
            <R val="14"/>
            <C val="14"/>
        </coord>
        <coord>
            <node id="0619"/>
            <R val="6"/>
            <C val="19"/>
        </coord>
        <coord>
            <node id="1418"/>
            <R val="14"/>
            <C val="18"/>
        </coord>
        <coord>
            <node id="0616"/>
            <R val="6"/>
            <C val="16"/>
        </coord>
        <coord>
            <node id="0109"/>
            <R val="1"/>
            <C val="9"/>
        </coord>
        <coord>
            <node id="0314"/>
            <R val="3"/>
            <C val="14"/>
        </coord>
        <coord>
            <node id="0107"/>
            <R val="1"/>
            <C val="7"/>
        </coord>
        <coord>
            <node id="1101"/>
            <R val="11"/>
            <C val="1"/>
        </coord>
        <coord>
            <node id="1413"/>
            <R val="14"/>
            <C val="13"/>
        </coord>
        <coord>
            <node id="0909"/>
            <R val="9"/>
            <C val="9"/>
        </coord>
        <coord>
            <node id="1116"/>
            <R val="11"/>
            <C val="16"/>
        </coord>
        <coord>
            <node id="1213"/>
            <R val="12"/>
            <C val="13"/>
        </coord>
        <coord>
            <node id="1515"/>
            <R val="15"/>
            <C val="15"/>
        </coord>
        <coord>
            <node id="0014"/>
            <R val="0"/>
            <C val="14"/>
        </coord>
        <coord>
            <node id="1217"/>
            <R val="12"/>
            <C val="17"/>
        </coord>
        <coord>
            <node id="0209"/>
            <R val="2"/>
            <C val="9"/>
        </coord>
        <coord>
            <node id="1020"/>
            <R val="10"/>
            <C val="20"/>
        </coord>
        <coord>
            <node id="1007"/>
            <R val="10"/>
            <C val="7"/>
        </coord>
        <coord>
            <node id="0416"/>
            <R val="4"/>
            <C val="16"/>
        </coord>
        <coord>
            <node id="1106"/>
            <R val="11"/>
            <C val="6"/>
        </coord>
        <coord>
            <node id="0204"/>
            <R val="2"/>
            <C val="4"/>
        </coord>
        <coord>
            <node id="1300"/>
            <R val="13"/>
            <C val="0"/>
        </coord>
        <coord>
            <node id="1519"/>
            <R val="15"/>
            <C val="19"/>
        </coord>
        <coord>
            <node id="0215"/>
            <R val="2"/>
            <C val="15"/>
        </coord>
        <coord>
            <node id="1214"/>
            <R val="12"/>
            <C val="14"/>
        </coord>
        <coord>
            <node id="1111"/>
            <R val="11"/>
            <C val="11"/>
        </coord>
        <coord>
            <node id="0002"/>
            <R val="0"/>
            <C val="2"/>
        </coord>
        <coord>
            <node id="0211"/>
            <R val="2"/>
            <C val="11"/>
        </coord>
        <coord>
            <node id="0607"/>
            <R val="6"/>
            <C val="7"/>
        </coord>
        <coord>
            <node id="1000"/>
            <R val="10"/>
            <C val="0"/>
        </coord>